{
  "candidate_sha": "aaaaaaaaaaaaaaaaaaaaaaaaaaaaaaaaaaaaaaaa",
  "ci_required": true,
  "facts_digest": "e0576340202063e4ed0e056ebb298dc4f3fe3889d373e68a0ecc552c810759b3",
  "final_validation_record": "/tmp/validation.json",
  "final_validation_satisfied": true,
  "prepared_at": "2099-01-01T00:11:00Z",
  "publication_authorization": "/tmp/publication-auth.json",
  "publication_record": "/tmp/publication.json",
  "publication_required": true,
  "publication_satisfied": true,
  "record_type": "FINAL_FACTS_PACKET",
  "remote": "origin",
  "remote_ci_record": "/tmp/ci.json",
  "remote_ci_satisfied": true,
  "remote_sha": "aaaaaaaaaaaaaaaaaaaaaaaaaaaaaaaaaaaaaaaa",
  "required_ci_checks": [
    {
      "allowed_conclusions": [
        "success"
      ],
      "name": "CI / validate"
    }
  ],
  "required_review_satisfied": true,
  "review_record": "/tmp/review.json",
  "run_id": "example-run",
  "schema_version": "2.1",
  "target_branch": "main",
  "target_reachable": true,
  "unresolved_blockers": []
}
